Q9NS56	reviewed	TOPRS_HUMAN	E3 ubiquitin-protein ligase Topors (EC 2.3.2.27) (RING-type E3 ubiquitin transferase Topors) (SUMO1-protein E3 ligase Topors) (Topoisomerase I-binding RING finger protein) (Topoisomerase I-binding arginine/serine-rich protein) (Tumor suppressor p53-binding protein 3) (p53-binding protein 3) (p53BP3)	TOPORS LUN TP53BPL	Homo sapiens (Human)	1045
Q9NS91	reviewed	RAD18_HUMAN	E3 ubiquitin-protein ligase RAD18 (EC 2.3.2.27) (Postreplication repair protein RAD18) (hHR18) (hRAD18) (RING finger protein 73) (RING-type E3 ubiquitin transferase RAD18)	RAD18 RNF73	Homo sapiens (Human)	495
Q9NSC2	reviewed	SALL1_HUMAN	Sal-like protein 1 (Spalt-like transcription factor 1) (Zinc finger protein 794) (Zinc finger protein SALL1) (Zinc finger protein Spalt-1) (HSal1) (Sal-1)	SALL1 SAL1 ZNF794	Homo sapiens (Human)	1324
Q9NSD4	reviewed	ZN275_HUMAN	Zinc finger protein 275	ZNF275	Homo sapiens (Human)	429
Q9NTW7	reviewed	ZF64B_HUMAN	Zinc finger protein 64 (Zfp-64) (Zinc finger protein 338)	ZFP64 ZNF338	Homo sapiens (Human)	645
Q9NTX7	reviewed	RN146_HUMAN	E3 ubiquitin-protein ligase RNF146 (EC 2.3.2.27) (Dactylidin) (Iduna) (RING finger protein 146) (RING-type E3 ubiquitin transferase RNF146)	RNF146	Homo sapiens (Human)	359
Q9NU63	reviewed	ZFP57_HUMAN	Zinc finger protein 57 homolog (Zfp-57) (Zinc finger protein 698)	ZFP57 C6orf40 ZNF698	Homo sapiens (Human)	452
Q9NUD5	reviewed	ZCHC3_HUMAN	Zinc finger CCHC domain-containing protein 3	ZCCHC3 C20orf99	Homo sapiens (Human)	403
Q9NUK0	reviewed	MBNL3_HUMAN	Muscleblind-like protein 3 (Cys3His CCG1-required protein) (Muscleblind-like X-linked protein) (Protein HCHCR)	MBNL3 CHCR MBLX39 MBXL	Homo sapiens (Human)	354
Q9NV58	reviewed	RN19A_HUMAN	E3 ubiquitin-protein ligase RNF19A (EC 2.3.2.31) (Double ring-finger protein) (Dorfin) (RING finger protein 19A) (p38)	RNF19A RNF19	Homo sapiens (Human)	838
Q9NVP4	reviewed	DZAN1_HUMAN	Double zinc ribbon and ankyrin repeat-containing protein 1	DZANK1 C20orf12 C20orf84	Homo sapiens (Human)	752
Q9NVV9	reviewed	THAP1_HUMAN	THAP domain-containing protein 1	THAP1	Homo sapiens (Human)	213
Q9NVW2	reviewed	RNF12_HUMAN	E3 ubiquitin-protein ligase RLIM (EC 2.3.2.27) (LIM domain-interacting RING finger protein) (RING finger LIM domain-binding protein) (R-LIM) (RING finger protein 12) (RING-type E3 ubiquitin transferase RLIM) (Renal carcinoma antigen NY-REN-43)	RLIM RNF12	Homo sapiens (Human)	624
Q9NW08	reviewed	RPC2_HUMAN	DNA-directed RNA polymerase III subunit RPC2 (RNA polymerase III subunit C2) (EC 2.7.7.6) (C128) (DNA-directed RNA polymerase III 127.6 kDa polypeptide) (DNA-directed RNA polymerase III subunit B)	POLR3B	Homo sapiens (Human)	1133
Q9NW38	reviewed	FANCL_HUMAN	E3 ubiquitin-protein ligase FANCL (EC 2.3.2.27) (Fanconi anemia group L protein) (Fanconi anemia-associated polypeptide of 43 kDa) (FAAP43) (RING-type E3 ubiquitin transferase FANCL)	FANCL PHF9	Homo sapiens (Human)	375
Q9NW64	reviewed	RBM22_HUMAN	Pre-mRNA-splicing factor RBM22 (RNA-binding motif protein 22) (Zinc finger CCCH domain-containing protein 16)	RBM22 ZC3H16 199G4	Homo sapiens (Human)	420
Q9NWF9	reviewed	RN216_HUMAN	E3 ubiquitin-protein ligase RNF216 (EC 2.3.2.27) (RING finger protein 216) (RING-type E3 ubiquitin transferase RNF216) (Triad domain-containing protein 3) (Ubiquitin-conjugating enzyme 7-interacting protein 1) (Zinc finger protein inhibiting NF-kappa-B)	RNF216 TRIAD3 UBCE7IP1 ZIN	Homo sapiens (Human)	866
Q9NWK9	reviewed	BCD1_HUMAN	Box C/D snoRNA protein 1 (Serologically defined breast cancer antigen NY-BR-75) (Zinc finger HIT domain-containing protein 6)	ZNHIT6 BCD1 C1orf181	Homo sapiens (Human)	470
Q9NWS9	reviewed	ZN446_HUMAN	Zinc finger protein 446 (Zinc finger protein with KRAB and SCAN domains 20)	ZNF446 ZKSCAN20	Homo sapiens (Human)	450
Q9NX47	reviewed	MARH5_HUMAN	E3 ubiquitin-protein ligase MARCHF5 (EC 2.3.2.27) (Membrane-associated RING finger protein 5) (Membrane-associated RING-CH protein V) (MARCH-V) (Mitochondrial ubiquitin ligase) (MITOL) (RING finger protein 153) (RING-type E3 ubiquitin transferase MARCHF5)	MARCHF5 MARCH5 RNF153	Homo sapiens (Human)	278
Q9NX58	reviewed	LYAR_HUMAN	Cell growth-regulating nucleolar protein	LYAR PNAS-5	Homo sapiens (Human)	379
Q9NX65	reviewed	ZSC32_HUMAN	Zinc finger and SCAN domain-containing protein 32 (Human cervical cancer suppressor gene 5 protein) (HCCS-5) (Zinc finger protein 434)	ZSCAN32 ZNF434 HCCS5	Homo sapiens (Human)	697
Q9NXC5	reviewed	MIOS_HUMAN	GATOR2 complex protein MIOS (Missing oocyte meiosis regulator homolog)	MIOS	Homo sapiens (Human)	875
Q9NXH9	reviewed	TRM1_HUMAN	"tRNA (guanine(26)-N(2))-dimethyltransferase (EC 2.1.1.216) (tRNA 2,2-dimethylguanosine-26 methyltransferase) (tRNA(guanine-26,N(2)-N(2)) methyltransferase) (tRNA(m(2,2)G26)dimethyltransferase)"	TRMT1	Homo sapiens (Human)	659
Q9NXI6	reviewed	RN186_HUMAN	E3 ubiquitin-protein ligase RNF186 (EC 2.3.2.27) (RING finger protein 186)	RNF186	Homo sapiens (Human)	227
Q9NXR8	reviewed	ING3_HUMAN	Inhibitor of growth protein 3 (p47ING3)	ING3 HSPC301	Homo sapiens (Human)	418
Q9NYA4	reviewed	MTMR4_HUMAN	Myotubularin-related protein 4 (EC 3.1.3.48) (FYVE domain-containing dual specificity protein phosphatase 2) (FYVE-DSP2) (Zinc finger FYVE domain-containing protein 11)	MTMR4 KIAA0647 ZFYVE11	Homo sapiens (Human)	1195
Q9NYG5	reviewed	APC11_HUMAN	Anaphase-promoting complex subunit 11 (APC11) (Cyclosome subunit 11) (Hepatocellular carcinoma-associated RING finger protein)	ANAPC11 HSPC214	Homo sapiens (Human)	84
Q9NYJ8	reviewed	TAB2_HUMAN	TGF-beta-activated kinase 1 and MAP3K7-binding protein 2 (Mitogen-activated protein kinase kinase kinase 7-interacting protein 2) (TAK1-binding protein 2) (TAB-2) (TGF-beta-activated kinase 1-binding protein 2)	TAB2 KIAA0733 MAP3K7IP2	Homo sapiens (Human)	693
Q9NYW8	reviewed	RBAK_HUMAN	RB-associated KRAB zinc finger protein (RB-associated KRAB repressor) (hRBaK) (Zinc finger protein 769)	RBAK ZNF769	Homo sapiens (Human)	714
Q9NZL3	reviewed	ZN224_HUMAN	Zinc finger protein 224 (Bone marrow zinc finger 2) (BMZF-2) (Zinc finger protein 233) (Zinc finger protein 255) (Zinc finger protein 27) (Zinc finger protein KOX22)	ZNF224 BMZF2 KOX22 ZNF233 ZNF255 ZNF27	Homo sapiens (Human)	707
Q9NZS9	reviewed	BFAR_HUMAN	Bifunctional apoptosis regulator (RING finger protein 47)	BFAR BAR RNF47	Homo sapiens (Human)	450
Q9NZV7	reviewed	ZIM2_HUMAN	Zinc finger imprinted 2 (Zinc finger protein 656)	ZIM2 ZNF656	Homo sapiens (Human)	527
Q9P0J7	reviewed	KCMF1_HUMAN	E3 ubiquitin-protein ligase KCMF1 (EC 2.3.2.27) (FGF-induced in gastric cancer) (Potassium channel modulatory factor) (PCMF) (RING-type E3 ubiquitin transferase KCMF1) (ZZ-type zinc finger-containing protein 1)	KCMF1 FIGC ZZZ1	Homo sapiens (Human)	381
Q9P0L1	reviewed	ZKSC7_HUMAN	Zinc finger protein with KRAB and SCAN domains 7 (Zinc finger protein 167) (Zinc finger protein 448) (Zinc finger protein 64)	ZKSCAN7 ZNF167 ZNF448 ZNF64	Homo sapiens (Human)	754
Q9P0N8	reviewed	MARH2_HUMAN	E3 ubiquitin-protein ligase MARCHF2 (EC 2.3.2.27) (Membrane-associated RING finger protein 2) (Membrane-associated RING-CH protein II) (MARCH-II) (RING finger protein 172) (RING-type E3 ubiquitin transferase MARCHF2)	MARCHF2 MARCH2 RNF172 HSPC240	Homo sapiens (Human)	246
Q9P0P0	reviewed	RN181_HUMAN	E3 ubiquitin-protein ligase RNF181 (EC 2.3.2.27) (RING finger protein 181)	RNF181 HSPC238	Homo sapiens (Human)	153
Q9P0T4	reviewed	ZN581_HUMAN	Zinc finger protein 581	ZNF581 HSPC189	Homo sapiens (Human)	197
Q9P0U4	reviewed	CXXC1_HUMAN	CXXC-type zinc finger protein 1 (CpG-binding protein) (PHD finger and CXXC domain-containing protein 1)	CXXC1 CFP1 CGBP PCCX1 PHF18	Homo sapiens (Human)	656
Q9P107	reviewed	GMIP_HUMAN	GEM-interacting protein (GMIP)	GMIP	Homo sapiens (Human)	970
Q9P1Z0	reviewed	ZBTB4_HUMAN	Zinc finger and BTB domain-containing protein 4 (KAISO-like zinc finger protein 1) (KAISO-L1)	ZBTB4 KIAA1538	Homo sapiens (Human)	1013
Q9P1Z2	reviewed	CACO1_HUMAN	Calcium-binding and coiled-coil domain-containing protein 1 (Calphoglin) (Coiled-coil coactivator protein) (Sarcoma antigen NY-SAR-3)	CALCOCO1 KIAA1536 PP13275 UNQ2436/PRO4996	Homo sapiens (Human)	691
Q9P243	reviewed	ZFAT_HUMAN	Zinc finger protein ZFAT (Zinc finger gene in AITD susceptibility region) (Zinc finger protein 406)	ZFAT KIAA1485 ZFAT1 ZNF406	Homo sapiens (Human)	1243
Q9P253	reviewed	VPS18_HUMAN	Vacuolar protein sorting-associated protein 18 homolog (hVPS18)	VPS18 KIAA1475	Homo sapiens (Human)	973
Q9P2E3	reviewed	ZNFX1_HUMAN	NFX1-type zinc finger-containing protein 1	ZNFX1 KIAA1404	Homo sapiens (Human)	1918
Q9P2E8	reviewed	MARH4_HUMAN	E3 ubiquitin-protein ligase MARCHF4 (EC 2.3.2.27) (Membrane-associated RING finger protein 4) (Membrane-associated RING-CH protein IV) (MARCH-IV) (RING finger protein 174) (RING-type E3 ubiquitin transferase MARCHF4)	MARCHF4 KIAA1399 MARCH4 RNF174	Homo sapiens (Human)	410
Q9P2F9	reviewed	ZN319_HUMAN	Zinc finger protein 319	ZNF319 KIAA1388	Homo sapiens (Human)	582
Q9P2G1	reviewed	AKIB1_HUMAN	Ankyrin repeat and IBR domain-containing protein 1 (EC 2.3.2.31)	ANKIB1 KIAA1386	Homo sapiens (Human)	1089
Q9P2R3	reviewed	ANFY1_HUMAN	Rabankyrin-5 (Rank-5) (Ankyrin repeat and FYVE domain-containing protein 1) (Ankyrin repeats hooked to a zinc finger motif)	ANKFY1 ANKHZN KIAA1255	Homo sapiens (Human)	1169
Q9P2R6	reviewed	RERE_HUMAN	Arginine-glutamic acid dipeptide repeats protein (Atrophin-1-like protein) (Atrophin-1-related protein)	RERE ARG ARP ATN1L KIAA0458	Homo sapiens (Human)	1566
Q9P2Y4	reviewed	ZN219_HUMAN	Zinc finger protein 219	ZNF219	Homo sapiens (Human)	722
Q9UBC3	reviewed	DNM3B_HUMAN	DNA (cytosine-5)-methyltransferase 3B (Dnmt3b) (EC 2.1.1.37) (DNA methyltransferase HsaIIIB) (DNA MTase HsaIIIB) (M.HsaIIIB)	DNMT3B	Homo sapiens (Human)	853
Q9UBF6	reviewed	RBX2_HUMAN	RING-box protein 2 (Rbx2) (CKII beta-binding protein 1) (CKBBP1) (RING finger protein 7) (Regulator of cullins 2) (Sensitive to apoptosis gene protein)	RNF7 RBX2 ROC2 SAG	Homo sapiens (Human)	113
Q9UBL3	reviewed	ASH2L_HUMAN	Set1/Ash2 histone methyltransferase complex subunit ASH2 (ASH2-like protein)	ASH2L ASH2L1	Homo sapiens (Human)	628
Q9UBN7	reviewed	HDAC6_HUMAN	Histone deacetylase 6 (HD6) (EC 3.5.1.98) (Tubulin-lysine deacetylase HDAC6) (EC 3.5.1.-)	HDAC6 KIAA0901 JM21	Homo sapiens (Human)	1215
Q9UBS8	reviewed	RNF14_HUMAN	E3 ubiquitin-protein ligase RNF14 (EC 2.3.2.31) (Androgen receptor-associated protein 54) (HFB30) (RING finger protein 14)	RNF14 ARA54 HRIHFB2038	Homo sapiens (Human)	474
Q9UBT6	reviewed	POLK_HUMAN	DNA polymerase kappa (EC 2.7.7.7) (DINB protein) (DINP)	POLK DINB1	Homo sapiens (Human)	870
Q9UBU7	reviewed	DBF4A_HUMAN	Protein DBF4 homolog A (Activator of S phase kinase) (Chiffon homolog A) (DBF4-type zinc finger-containing protein 1)	DBF4 ASK DBF4A ZDBF1	Homo sapiens (Human)	674
Q9UBW7	reviewed	ZMYM2_HUMAN	Zinc finger MYM-type protein 2 (Fused in myeloproliferative disorders protein) (Rearranged in atypical myeloproliferative disorder protein) (Zinc finger protein 198)	ZMYM2 FIM RAMP ZNF198	Homo sapiens (Human)	1377
Q9UBZ4	reviewed	APEX2_HUMAN	DNA-(apurinic or apyrimidinic site) endonuclease 2 (EC 3.1.11.2) (AP endonuclease XTH2) (APEX nuclease 2) (APEX nuclease-like 2) (Apurinic-apyrimidinic endonuclease 2) (AP endonuclease 2)	APEX2 APE2 APEXL2 XTH2	Homo sapiens (Human)	518
Q9UC07	reviewed	ZNF69_HUMAN	Zinc finger protein 69 (hZNF3)	ZNF69	Homo sapiens (Human)	566
Q9UDV6	reviewed	ZN212_HUMAN	Zinc finger protein 212 (Zinc finger protein C2H2-150)	ZNF212 ZNFC150	Homo sapiens (Human)	495
Q9UDW3	reviewed	ZMAT5_HUMAN	Zinc finger matrin-type protein 5 (U11/U12 small nuclear ribonucleoprotein 20 kDa protein) (U11/U12 snRNP 20 kDa protein) (U11/U12-20K)	ZMAT5	Homo sapiens (Human)	170
Q9UDY6	reviewed	TRI10_HUMAN	Tripartite motif-containing protein 10 (B30-RING finger protein) (RING finger protein 9)	TRIM10 RFB30 RNF9	Homo sapiens (Human)	481
Q9UEG4	reviewed	ZN629_HUMAN	Zinc finger protein 629 (Zinc finger protein 65)	ZNF629 KIAA0326 ZNF65	Homo sapiens (Human)	869
Q9UFB7	reviewed	ZBT47_HUMAN	Zinc finger and BTB domain-containing protein 47 (Zinc finger protein 651)	ZBTB47 KIAA1190 ZNF651	Homo sapiens (Human)	747
Q9UGI0	reviewed	ZRAN1_HUMAN	Ubiquitin thioesterase ZRANB1 (EC 3.4.19.12) (TRAF-binding domain-containing protein) (hTrabid) (Zinc finger Ran-binding domain-containing protein 1)	ZRANB1 TRABID	Homo sapiens (Human)	708
Q9UGL1	reviewed	KDM5B_HUMAN	Lysine-specific demethylase 5B (EC 1.14.11.67) (Cancer/testis antigen 31) (CT31) (Histone demethylase JARID1B) (Jumonji/ARID domain-containing protein 1B) (PLU-1) (Retinoblastoma-binding protein 2 homolog 1) (RBP2-H1) ([histone H3]-trimethyl-L-lysine(4) demethylase 5B)	KDM5B JARID1B PLU1 RBBP2H1	Homo sapiens (Human)	1544
Q9UGR2	reviewed	Z3H7B_HUMAN	Zinc finger CCCH domain-containing protein 7B (Rotavirus 'X'-associated non-structural protein) (RoXaN)	ZC3H7B KIAA1031	Homo sapiens (Human)	977
Q9UGU0	reviewed	TCF20_HUMAN	Transcription factor 20 (TCF-20) (Nuclear factor SPBP) (Protein AR1) (Stromelysin-1 PDGF-responsive element-binding protein) (SPRE-binding protein)	TCF20 KIAA0292 SPBP	Homo sapiens (Human)	1960
Q9UH73	reviewed	COE1_HUMAN	Transcription factor COE1 (O/E-1) (OE-1) (Early B-cell factor)	EBF1 COE1 EBF	Homo sapiens (Human)	591
Q9UHC7	reviewed	MKRN1_HUMAN	E3 ubiquitin-protein ligase makorin-1 (EC 2.3.2.27) (RING finger protein 61) (RING-type E3 ubiquitin transferase makorin-1)	MKRN1 RNF61	Homo sapiens (Human)	482
Q9UHF7	reviewed	TRPS1_HUMAN	Zinc finger transcription factor Trps1 (Tricho-rhino-phalangeal syndrome type I protein) (Zinc finger protein GC79)	TRPS1	Homo sapiens (Human)	1281
Q9UHK0	reviewed	NUFP1_HUMAN	FMR1-interacting protein NUFIP1 (Nuclear FMR1-interacting protein 1) (Nuclear FMRP-interacting protein 1)	NUFIP1	Homo sapiens (Human)	495
Q9UID6	reviewed	ZN639_HUMAN	Zinc finger protein 639 (Zinc finger protein ANC_2H01) (Zinc finger protein ZASC1)	ZNF639 ZASC1	Homo sapiens (Human)	485
Q9UIE0	reviewed	ZN230_HUMAN	Zinc finger protein 230 (Zinc finger protein FDZF2)	ZNF230 FDZF2	Homo sapiens (Human)	474
Q9UIF8	reviewed	BAZ2B_HUMAN	Bromodomain adjacent to zinc finger domain protein 2B (hWALp4)	BAZ2B KIAA1476	Homo sapiens (Human)	2168
Q9UIF9	reviewed	BAZ2A_HUMAN	Bromodomain adjacent to zinc finger domain protein 2A (Transcription termination factor I-interacting protein 5) (TTF-I-interacting protein 5) (Tip5) (hWALp3)	BAZ2A KIAA0314 TIP5	Homo sapiens (Human)	1905
Q9UIG0	reviewed	BAZ1B_HUMAN	Tyrosine-protein kinase BAZ1B (EC 2.7.10.2) (Bromodomain adjacent to zinc finger domain protein 1B) (Williams syndrome transcription factor) (Williams-Beuren syndrome chromosomal region 10 protein) (Williams-Beuren syndrome chromosomal region 9 protein) (hWALp2)	BAZ1B WBSC10 WBSCR10 WBSCR9 WSTF	Homo sapiens (Human)	1483
Q9UIH9	reviewed	KLF15_HUMAN	Krueppel-like factor 15 (Kidney-enriched krueppel-like factor)	KLF15 KKLF	Homo sapiens (Human)	416
Q9UIL8	reviewed	PHF11_HUMAN	PHD finger protein 11 (BRCA1 C-terminus-associated protein) (Renal carcinoma antigen NY-REN-34)	PHF11 BCAP	Homo sapiens (Human)	331
Q9UIS9	reviewed	MBD1_HUMAN	Methyl-CpG-binding domain protein 1 (CXXC-type zinc finger protein 3) (Methyl-CpG-binding protein MBD1) (Protein containing methyl-CpG-binding domain 1)	MBD1 CXXC3 PCM1	Homo sapiens (Human)	605
Q9UJ41	reviewed	RABX5_HUMAN	Rab5 GDP/GTP exchange factor (RAP1) (Rabaptin-5-associated exchange factor for Rab5) (Rabex-5)	RABGEF1 RABEX5	Homo sapiens (Human)	491
Q9UJ78	reviewed	ZMYM5_HUMAN	Zinc finger MYM-type protein 5 (Zinc finger protein 198-like 1) (Zinc finger protein 237)	ZMYM5 ZNF198L1 ZNF237 HSPC050	Homo sapiens (Human)	669
Q9UJL9	reviewed	ZF69B_HUMAN	Zinc finger protein 69 homolog B (Zinc finger protein 643)	ZFP69B ZNF643	Homo sapiens (Human)	534
Q9UJQ4	reviewed	SALL4_HUMAN	Sal-like protein 4 (Zinc finger protein 797) (Zinc finger protein SALL4)	SALL4 ZNF797	Homo sapiens (Human)	1053
Q9UJV3	reviewed	TRIM1_HUMAN	Probable E3 ubiquitin-protein ligase MID2 (EC 2.3.2.27) (Midin-2) (Midline defect 2) (Midline-2) (RING finger protein 60) (RING-type E3 ubiquitin transferase MID2) (Tripartite motif-containing protein 1)	MID2 FXY2 RNF60 TRIM1	Homo sapiens (Human)	735
Q9UJV9	reviewed	DDX41_HUMAN	Probable ATP-dependent RNA helicase DDX41 (EC 3.6.4.13) (DEAD box protein 41) (DEAD box protein abstrakt homolog)	DDX41 ABS	Homo sapiens (Human)	622
Q9UJW3	reviewed	DNM3L_HUMAN	DNA (cytosine-5)-methyltransferase 3-like	DNMT3L	Homo sapiens (Human)	386
Q9UJW8	reviewed	ZN180_HUMAN	Zinc finger protein 180 (HHZ168)	ZNF180	Homo sapiens (Human)	692
Q9UK33	reviewed	ZN580_HUMAN	Zinc finger protein 580 (LDL-induced EC protein)	ZNF580	Homo sapiens (Human)	172
Q9UK53	reviewed	ING1_HUMAN	Inhibitor of growth protein 1	ING1	Homo sapiens (Human)	422
Q9UKN5	reviewed	PRDM4_HUMAN	PR domain zinc finger protein 4 (EC 2.1.1.-) (PR domain-containing protein 4)	PRDM4 PFM1	Homo sapiens (Human)	801
Q9UKS7	reviewed	IKZF2_HUMAN	Zinc finger protein Helios (Ikaros family zinc finger protein 2)	IKZF2 HELIOS ZNFN1A2	Homo sapiens (Human)	526
Q9UKT4	reviewed	FBX5_HUMAN	F-box only protein 5 (Early mitotic inhibitor 1)	FBXO5 EMI1 FBX5	Homo sapiens (Human)	447
Q9UKT9	reviewed	IKZF3_HUMAN	Zinc finger protein Aiolos (Ikaros family zinc finger protein 3)	IKZF3 ZNFN1A3	Homo sapiens (Human)	509
Q9UKV5	reviewed	AMFR_HUMAN	E3 ubiquitin-protein ligase AMFR (EC 2.3.2.36) (Autocrine motility factor receptor) (AMF receptor) (RING finger protein 45) (gp78)	AMFR RNF45	Homo sapiens (Human)	643
Q9UKW4	reviewed	VAV3_HUMAN	Guanine nucleotide exchange factor VAV3 (VAV-3)	VAV3	Homo sapiens (Human)	847
Q9UKY1	reviewed	ZHX1_HUMAN	Zinc fingers and homeoboxes protein 1	ZHX1	Homo sapiens (Human)	873
Q9UL40	reviewed	ZN346_HUMAN	Zinc finger protein 346 (Just another zinc finger protein)	ZNF346 JAZ	Homo sapiens (Human)	294
Q9UL41	reviewed	PNMA3_HUMAN	Paraneoplastic antigen Ma3	PNMA3 MA3	Homo sapiens (Human)	463
Q9UL68	reviewed	MYT1L_HUMAN	Myelin transcription factor 1-like protein (MyT1-L) (MyT1L)	MYT1L KIAA1106	Homo sapiens (Human)	1186
Q9ULD4	reviewed	BRPF3_HUMAN	Bromodomain and PHD finger-containing protein 3	BRPF3 KIAA1286	Homo sapiens (Human)	1205
Q9ULD5	reviewed	ZN777_HUMAN	Zinc finger protein 777	ZNF777 KIAA1285	Homo sapiens (Human)	831
Q9ULH1	reviewed	ASAP1_HUMAN	"Arf-GAP with SH3 domain, ANK repeat and PH domain-containing protein 1 (130 kDa phosphatidylinositol 4,5-bisphosphate-dependent ARF1 GTPase-activating protein) (ADP-ribosylation factor-directed GTPase-activating protein 1) (ARF GTPase-activating protein 1) (Development and differentiation-enhancing factor 1) (DEF-1) (Differentiation-enhancing factor 1) (PIP2-dependent ARF1 GAP)"	ASAP1 DDEF1 KIAA1249 PAG2	Homo sapiens (Human)	1129
Q9ULJ3	reviewed	ZBT21_HUMAN	Zinc finger and BTB domain-containing protein 21 (Zinc finger protein 295)	ZBTB21 KIAA1227 ZNF295	Homo sapiens (Human)	1066
Q9ULJ6	reviewed	ZMIZ1_HUMAN	Zinc finger MIZ domain-containing protein 1 (PIAS-like protein Zimp10) (Retinoic acid-induced protein 17)	ZMIZ1 KIAA1224 RAI17 ZIMP10	Homo sapiens (Human)	1067
Q9ULM2	reviewed	ZN490_HUMAN	Zinc finger protein 490	ZNF490 KIAA1198	Homo sapiens (Human)	529
Q9ULT6	reviewed	ZNRF3_HUMAN	E3 ubiquitin-protein ligase ZNRF3 (EC 2.3.2.27) (RING finger protein 203) (RING-type E3 ubiquitin transferase ZNRF3) (Zinc/RING finger protein 3)	ZNRF3 KIAA1133 RNF203	Homo sapiens (Human)	936
Q9ULU4	reviewed	ZMYD8_HUMAN	MYND-type zinc finger-containing chromatin reader ZMYND8 (Cutaneous T-cell lymphoma-associated antigen se14-3) (CTCL-associated antigen se14-3) (Protein kinase C-binding protein 1) (Rack7) (Transcription coregulator ZMYND8) (Zinc finger MYND domain-containing protein 8)	ZMYND8 KIAA1125 PRKCBP1 RACK7	Homo sapiens (Human)	1186
Q9ULV3	reviewed	CIZ1_HUMAN	Cip1-interacting zinc finger protein (CDKN1A-interacting zinc finger protein 1) (Nuclear protein NP94) (Zinc finger protein 356)	CIZ1 LSFR1 NP94 ZNF356	Homo sapiens (Human)	898
Q9ULV8	reviewed	CBLC_HUMAN	E3 ubiquitin-protein ligase CBL-C (EC 2.3.2.27) (RING finger protein 57) (RING-type E3 ubiquitin transferase CBL-C) (SH3-binding protein CBL-3) (SH3-binding protein CBL-C) (Signal transduction protein CBL-C)	CBLC CBL3 RNF57	Homo sapiens (Human)	474
Q9ULX3	reviewed	NOB1_HUMAN	RNA-binding protein NOB1 (EC 3.1.-.-) (Phosphorylation regulatory protein HP-10) (Protein ART-4)	NOB1 ART4 NOB1P PSMD8BP1 MSTP158	Homo sapiens (Human)	412
Q9ULX5	reviewed	RN112_HUMAN	RING finger protein 112 (EC 2.3.2.27) (Brain finger protein) (Zinc finger protein 179)	RNF112 BFP ZNF179	Homo sapiens (Human)	631
Q9ULX6	reviewed	AKP8L_HUMAN	A-kinase anchor protein 8-like (AKAP8-like protein) (Helicase A-binding protein 95) (HAP95) (Homologous to AKAP95 protein) (HA95) (Neighbor of A-kinase-anchoring protein 95) (Neighbor of AKAP95)	AKAP8L NAKAP NAKAP95 HRIHFB2018	Homo sapiens (Human)	646
Q9UM63	reviewed	PLAL1_HUMAN	Zinc finger protein PLAGL1 (Lost on transformation 1) (LOT-1) (Pleiomorphic adenoma-like protein 1) (Tumor suppressor ZAC)	PLAGL1 LOT1 ZAC	Homo sapiens (Human)	463
Q9UMN6	reviewed	KMT2B_HUMAN	Histone-lysine N-methyltransferase 2B (Lysine N-methyltransferase 2B) (EC 2.1.1.364) (Myeloid/lymphoid or mixed-lineage leukemia protein 4) (Trithorax homolog 2) (WW domain-binding protein 7) (WBP-7)	KMT2B HRX2 KIAA0304 MLL2 MLL4 TRX2 WBP7	Homo sapiens (Human)	2715
Q9UNE2	reviewed	RPH3L_HUMAN	Rab effector Noc2 (No C2 domains protein) (Rabphilin-3A-like protein)	RPH3AL NOC2	Homo sapiens (Human)	315
Q9UNL4	reviewed	ING4_HUMAN	Inhibitor of growth protein 4 (p29ING4)	ING4 My036	Homo sapiens (Human)	249
Q9UNY4	reviewed	TTF2_HUMAN	Transcription termination factor 2 (EC 3.6.4.-) (Lodestar homolog) (RNA polymerase II termination factor) (Transcription release factor 2) (F2) (HuF2)	TTF2	Homo sapiens (Human)	1162
Q9UNY5	reviewed	ZN232_HUMAN	Zinc finger protein 232 (Zinc finger and SCAN domain-containing protein 11)	ZNF232 ZSCAN11	Homo sapiens (Human)	444
Q9UPA5	reviewed	BSN_HUMAN	Protein bassoon (Zinc finger protein 231)	BSN KIAA0434 ZNF231	Homo sapiens (Human)	3926
Q9UPG8	reviewed	PLAL2_HUMAN	Zinc finger protein PLAGL2 (Pleiomorphic adenoma-like protein 2)	PLAGL2 KIAA0198	Homo sapiens (Human)	496
Q9UPN9	reviewed	TRI33_HUMAN	E3 ubiquitin-protein ligase TRIM33 (EC 2.3.2.27) (Ectodermin homolog) (RET-fused gene 7 protein) (Protein Rfg7) (RING-type E3 ubiquitin transferase TRIM33) (Transcription intermediary factor 1-gamma) (TIF1-gamma) (Tripartite motif-containing protein 33)	TRIM33 KIAA1113 RFG7 TIF1G	Homo sapiens (Human)	1127
Q9UPP1	reviewed	PHF8_HUMAN	Histone lysine demethylase PHF8 (EC 1.14.11.27) (EC 1.14.11.65) (PHD finger protein 8) ([histone H3]-dimethyl-L-lysine(36) demethylase PHF8) ([histone H3]-dimethyl-L-lysine(9) demethylase PHF8)	PHF8 KIAA1111 ZNF422	Homo sapiens (Human)	1060
Q9UPQ3	reviewed	AGAP1_HUMAN	"Arf-GAP with GTPase, ANK repeat and PH domain-containing protein 1 (AGAP-1) (Centaurin-gamma-2) (Cnt-g2) (GTP-binding and GTPase-activating protein 1) (GGAP1)"	AGAP1 CENTG2 KIAA1099	Homo sapiens (Human)	857
Q9UPQ4	reviewed	TRI35_HUMAN	E3 ubiquitin-protein ligase TRIM35 (EC 2.3.2.27) (Hemopoietic lineage switch protein 5)	TRIM35 HLS5 KIAA1098	Homo sapiens (Human)	493
Q9UPQ7	reviewed	PZRN3_HUMAN	E3 ubiquitin-protein ligase PDZRN3 (EC 2.3.2.27) (Ligand of Numb protein X 3) (PDZ domain-containing RING finger protein 3) (RING-type E3 ubiquitin transferase PDZRN3) (Semaphorin cytoplasmic domain-associated protein 3) (Protein SEMACAP3)	PDZRN3 KIAA1095 LNX3 SEMCAP3	Homo sapiens (Human)	1066
Q9UPT8	reviewed	ZC3H4_HUMAN	Zinc finger CCCH domain-containing protein 4	ZC3H4 C19orf7 KIAA1064	Homo sapiens (Human)	1303
Q9UPT9	reviewed	UBP22_HUMAN	Ubiquitin carboxyl-terminal hydrolase 22 (EC 3.4.19.12) (Deubiquitinating enzyme 22) (Ubiquitin thioesterase 22) (Ubiquitin-specific-processing protease 22)	USP22 KIAA1063 USP3L	Homo sapiens (Human)	525
Q9UPV7	reviewed	PHF24_HUMAN	PHD finger protein 24	PHF24 KIAA1045	Homo sapiens (Human)	400
Q9UPW8	reviewed	UN13A_HUMAN	Protein unc-13 homolog A (Munc13-1)	UNC13A KIAA1032	Homo sapiens (Human)	1703
Q9UQ26	reviewed	RIMS2_HUMAN	Regulating synaptic membrane exocytosis protein 2 (Rab-3-interacting molecule 2) (RIM 2) (Rab-3-interacting protein 3)	RIMS2 KIAA0751 RAB3IP3 RIM2	Homo sapiens (Human)	1411
Q9UQR1	reviewed	ZN148_HUMAN	Zinc finger protein 148 (Transcription factor ZBP-89) (Zinc finger DNA-binding protein 89)	ZNF148 ZBP89	Homo sapiens (Human)	794
Q9WJR5	reviewed	POK19_HUMAN	Endogenous retrovirus group K member 19 Pol protein (HERV-K(C19) Pol protein) (HERV-K_19q11 provirus ancestral Pol protein) [Includes: Reverse transcriptase (RT) (EC 2.7.7.49); Ribonuclease H (RNase H) (EC 3.1.26.4); Integrase (IN)]	ERVK-19	Homo sapiens (Human)	959
Q9Y225	reviewed	RNF24_HUMAN	RING finger protein 24	RNF24	Homo sapiens (Human)	148
Q9Y242	reviewed	TCF19_HUMAN	Transcription factor 19 (TCF-19) (Transcription factor SC1)	TCF19 SC1	Homo sapiens (Human)	345
Q9Y252	reviewed	RNF6_HUMAN	E3 ubiquitin-protein ligase RNF6 (EC 2.3.2.27)	RNF6 SPG2	Homo sapiens (Human)	685
Q9Y253	reviewed	POLH_HUMAN	DNA polymerase eta (EC 2.7.7.7) (RAD30 homolog A) (Xeroderma pigmentosum variant type protein)	POLH RAD30 RAD30A XPV	Homo sapiens (Human)	713
Q9Y2E6	reviewed	DTX4_HUMAN	E3 ubiquitin-protein ligase DTX4 (EC 2.3.2.27) (Protein deltex-4) (Deltex4) (RING finger protein 155) (RING-type E3 ubiquitin transferase DTX4)	DTX4 KIAA0937 RNF155	Homo sapiens (Human)	619
Q9Y2I7	reviewed	FYV1_HUMAN	1-phosphatidylinositol 3-phosphate 5-kinase (Phosphatidylinositol 3-phosphate 5-kinase) (EC 2.7.1.150) (FYVE finger-containing phosphoinositide kinase) (PIKfyve) (Phosphatidylinositol 3-phosphate 5-kinase type III) (PIPkin-III) (Type III PIP kinase) (Serine-protein kinase PIKFYVE) (EC 2.7.11.1)	PIKFYVE KIAA0981 PIP5K3	Homo sapiens (Human)	2098
Q9Y2J0	reviewed	RP3A_HUMAN	Rabphilin-3A (Exophilin-1)	RPH3A KIAA0985	Homo sapiens (Human)	694
